{
  "package_kind": "l2g_ssp_word_qa_sidecar_v1",
  "package_version": "1.0",
  "schema_uri": "urn:l2g:contracts:l2g_ssp_word_qa_sidecar_v1:1.0",
  "sidecar_id": "sha256:fc0d03cafdcc4ab95a0b0fc80808d29a42125de2e9cb6856bff157a1579da1bd",
  "created_at": "2026-07-30T14:10:00Z",
  "producer": {
    "tool": "builder-merger",
    "version": "3.10.0-proposed",
    "instance_id": "local-browser"
  },
  "consumer": {
    "tool": "ssp",
    "minimum_version": "1.9.17-proposed"
  },
  "scope": {
    "mode": "single-system",
    "portfolio_id": null,
    "module_id": "single-system"
  },
  "source": {
    "ssp_release_version": "1.9.16",
    "working_data_schema_version": "1.9.11",
    "document_version": "1.0",
    "review_package_id": "SSP-REV-20260730-133500-4FZZ",
    "source_ssp_fingerprint": "c4320e890630b90830b9c0d71b7ea35e0803e6a74cb4f6a86e1f54a73e90eaeb",
    "source_snapshot_sha256": "c4320e890630b90830b9c0d71b7ea35e0803e6a74cb4f6a86e1f54a73e90eaeb",
    "word_export_manifest_sha256": "fd2c553716ed1a99cf39f8ac1fee7b0417a6fb0f7519097544b411b8c842b6eb"
  },
  "artifact": {
    "file_name": "ssp_changed_source.docx",
    "media_type": "application/vnd.openxmlformats-officedocument.wordprocessingml.document",
    "sha256": "36d86ce025183757050f9157b9bbed59e752d0a24fa7480884962e3d37090c7a",
    "size_bytes": 80037
  },
  "qa_profile": {
    "id": "l2g-builder-merger-final-word-qa-v1",
    "version": "1.0",
    "sha256": "9aec3fd144e9f8ccfefdd3dd1ba5605ec0364127459f8cbded71904cf02b789c"
  },
  "checks": [
    {
      "check_id": "WQA-PACKAGE-OPEN",
      "classification": "automated",
      "result": "pass",
      "severity": "blocking",
      "summary": "DOCX package opens and required Open XML parts are readable.",
      "evidence_refs": [
        "docx:[Content_Types].xml",
        "docx:word/document.xml"
      ]
    },
    {
      "check_id": "WQA-SOURCE-IDENTITY",
      "classification": "automated",
      "result": "pass",
      "severity": "blocking",
      "summary": "Embedded SSP export identity reconciles with the sidecar source block.",
      "evidence_refs": [
        "manifest:sourceFingerprint",
        "manifest:reviewPackageId",
        "manifest:documentVersion"
      ]
    },
    {
      "check_id": "WQA-UNRESOLVED-TOKENS",
      "classification": "automated",
      "result": "pass",
      "severity": "blocking",
      "summary": "No governed unresolved placeholder tokens were detected.",
      "evidence_refs": [
        "scan:unresolved-token-count=0"
      ]
    },
    {
      "check_id": "WQA-COMMENTS-REVISIONS",
      "classification": "automated",
      "result": "pass",
      "severity": "blocking",
      "summary": "No unresolved comments or tracked revisions remain in the final artifact.",
      "evidence_refs": [
        "scan:comments=0",
        "scan:revisions=0"
      ]
    },
    {
      "check_id": "WQA-LAYOUT-HUMAN",
      "classification": "human",
      "result": "pass",
      "severity": "blocking",
      "summary": "Locally asserted visual review confirmed headings, tables, page breaks, headers, footers, and numbering are usable.",
      "evidence_refs": [
        "operator:visual-review"
      ]
    }
  ],
  "aggregate": {
    "state": "qa_complete",
    "pass": 5,
    "fail": 0,
    "needs_human_review": 0,
    "not_applicable": 0
  },
  "operator_assertions": [
    {
      "check_id": "WQA-LAYOUT-HUMAN",
      "local_id": "rg4-fixture-reviewer",
      "display_name": "Local QA Reviewer",
      "asserted_at": "2026-07-30T14:09:00Z",
      "locally_asserted": true,
      "authenticated": false,
      "digital_signature": false
    }
  ],
  "lineage": {
    "lineage_key": "c444c55ee315723ad301455775f2aafb8824895331a8714007c987db2eba5354",
    "attempt_number": 2,
    "supersedes_sidecar_id": "sha256:f6928d1cdcf385140880f1ef023407c0e72cfc755664f9a1184e73421029e5b4"
  },
  "authority": {
    "final_word_qa_evidence_only": true,
    "cmmc_readiness": false,
    "compliance": false,
    "assessment": false,
    "certification": false,
    "scoring": false,
    "client_release_approval": false,
    "authenticated_identity": false,
    "digital_signature": false
  },
  "package_fingerprint": "4037b2993764c5e378fc386edbf77c3a165eb6f9b771788f5e4793986a399ba7"
}
